{
  "g": 1,
  "kind": "screen",
  "key": "STATION",
  "name": "Station",
  "description": "One station: its CIP-002 impact rating — recorded here because it is the station's, and every BES Cyber Asset at it inherits it (the owner, 2026-09-16) — with the primary assets that have a terminal here and the schemes here (#171). Plain code; the definition names its data.",
  "permission": "Asset.Read",
  "screenKind": "record",
  "params": {
    "view": "location.vNode",
    "key": "EntityId"
  }
}
