{
  "g": 1,
  "kind": "screen",
  "key": "SCHEME",
  "name": "Protection scheme",
  "description": "One protection scheme: the relays and equipment in it, what it protects, the CTs and VTs feeding it, and the change requests against it.",
  "permission": "Scheme.Read",
  "screenKind": "record",
  "params": {
    "view": "scheme.vScheme",
    "key": "EntityId"
  }
}