{
  "g": 1,
  "kind": "screen",
  "key": "PRIMARY_ASSET",
  "name": "Primary asset",
  "description": "One primary asset, a line, transformer, bus, breaker, generator, capacitor or reactor: where it is, its terminals, the schemes that protect it, its ratings, and the classifications recorded from the studies (CIP impact, BES, NPCC BPS, A-10, PRC-023). A line also carries its impedance and length.",
  "permission": "Asset.Read",
  "screenKind": "record",
  "params": {
    "view": "asset.vPrimaryAsset",
    "key": "EntityId"
  }
}
